{
  "contractVersion": "orgx-bench-v1.2",
  "releaseId": "sota-headline-2026-q3-draft",
  "releaseDate": "2026-07-09",
  "status": "draft_preflight",
  "publicationLabel": "headline",
  "preregistration": {
    "protocolPath": "docs/strategy/benchmark-v1.2-defensibility-plan-2026-07-09.md",
    "protocolHash": "sha256:ea3e451a0ea3b09891d23b58b96d42ebd9e711b5dba2a80780550ee48e03df6a",
    "committedAt": "2026-07-09T20:00:00.000Z",
    "firstRunLaunchedAt": null
  },
  "frontierSweep": {
    "frontierModels": [
      "openai/gpt-5.6-high",
      "openai/gpt-6",
      "anthropic/claude-fable-5",
      "anthropic/claude-opus-4.8",
      "google/gemini-3",
      "deepseek/deepseek-v4-pro",
      "fugu/fugu-ultra"
    ],
    "arms": [
      "raw",
      "best_of_n",
      "self_reflection",
      "open_agent_scaffold",
      "orgx_full",
      "orgx_minus_verification",
      "orgx_minus_memory_provenance",
      "orgx_minus_approval_gate",
      "timed_human"
    ],
    "minK": 8,
    "minEpisodesPerCell": 8,
    "metrics": [
      "pass_at_k",
      "pass_pow_k",
      "horizon_50",
      "horizon_80",
      "gate_depth",
      "cost_per_accepted_work_product",
      "human_rework_minutes",
      "perturbation_survival_rate"
    ]
  },
  "evidence": {
    "registryPath": "worlds/corpus-splits.json",
    "humanBaselinePlanPath": "results/human-baseline-plan.example.json",
    "humanBaselineSummaryPath": "results/human-baseline-summary.json",
    "executionLedgerPath": "results/sota-execution-ledger.example.json",
    "headlineBundlePath": null,
    "externalReplicationSource": "headline_bundle_metadata",
    "externalReplicationEvidencePath": null,
    "strangerReproductionReceiptPath": null,
    "worldQualityAuditPath": "results/world-quality-audit.example.json",
    "contaminationAuditPath": "results/contamination-audit.example.json",
    "statisticalPrecisionReportPath": "results/statistical-precision-report.example.json",
    "correctionLedgerPath": "results/benchmark-correction-ledger.json"
  }
}
